{"id":"kcdc-logo-deck","shop_slug":"kcdc-skateshop","name":"KCDC Logo Deck","brand":"KCDC","category":"decks","subcategory":"street","price":60.00,"currency":"USD","size":"8.25","in_stock":true,"quantity":8,"image":"","url":"","tags":["street","logo","house-brand"],"last_updated":"2026-02-10T00:00:00Z"}
