{"id":"bones-stf-v5","shop_slug":"uptown-riders","name":"Bones STF V5 Sidecut 52mm","brand":"Bones","category":"wheels","subcategory":"street","price":38.00,"currency":"USD","size":"52mm","in_stock":true,"quantity":10,"image":"","url":"","tags":["wheels","street"],"last_updated":"2026-02-10T00:00:00Z"}
