{"id":"spitfire-classic-53","shop_slug":"kcdc-skateshop","name":"Spitfire Classic 53mm","brand":"Spitfire","category":"wheels","subcategory":"street","price":36.00,"currency":"USD","size":"53mm","in_stock":true,"quantity":10,"image":"","url":"","tags":["wheels","street"],"last_updated":"2026-02-10T00:00:00Z"}
