{"id":"orangatang-stimulus","shop_slug":"uncle-funkys-boards","name":"Orangatang Stimulus 70mm","brand":"Orangatang","category":"wheels","subcategory":"longboard","price":42.00,"currency":"USD","size":"70mm","in_stock":false,"quantity":0,"tags":["longboard","freeride"],"last_updated":"2026-02-10T00:00:00Z"}
