{"id":"april-deck-8125","shop_slug":"seasons-skateshop","name":"April Skateboards Deck 8.125","brand":"April","category":"decks","subcategory":"street","price":62.00,"currency":"USD","size":"8.125","in_stock":true,"quantity":7,"image":"","url":"","tags":["street","deck"],"last_updated":"2026-02-10T00:00:00Z"}
