{"id":"mob-grip-sheet","shop_slug":"dolo-skate-co","name":"MOB Grip Sheet","brand":"MOB","category":"accessories","subcategory":"griptape","price":7.00,"currency":"USD","size":"9x33","in_stock":true,"quantity":20,"image":"","url":"","tags":["griptape","essentials"],"last_updated":"2026-02-10T00:00:00Z"}
