{"id":"labor-deck-classic","shop_slug":"labor-skateshop","name":"Labor Classic Logo Deck","brand":"Labor","category":"decks","subcategory":"street","price":65.00,"currency":"USD","size":"8.25","in_stock":true,"quantity":12,"image":"","url":"","tags":["street","logo","house-brand"],"last_updated":"2026-02-10T00:00:00Z"}
