{"id":"independent-139","shop_slug":"dolo-skate-co","name":"Independent Stage 11 139","brand":"Independent","category":"trucks","subcategory":"standard","price":56.00,"currency":"USD","size":"139","in_stock":true,"quantity":6,"image":"","url":"","tags":["trucks","classic"],"last_updated":"2026-02-10T00:00:00Z"}
