{"id":"landyachtz-dinghy","shop_slug":"uncle-funkys-boards","name":"Landyachtz Dinghy Classic","brand":"Landyachtz","category":"completes","subcategory":"cruiser","price":150.00,"currency":"USD","size":"28.5","in_stock":true,"quantity":3,"tags":["cruiser","beginner-friendly"],"last_updated":"2026-02-10T00:00:00Z"}
