{"id":"venture-5-2-trucks","shop_slug":"uptown-riders","name":"Venture V-Light 5.2 Trucks","brand":"Venture","category":"trucks","subcategory":"standard","price":52.00,"currency":"USD","size":"5.2","in_stock":true,"quantity":6,"image":"","url":"","tags":["trucks","lightweight"],"last_updated":"2026-02-10T00:00:00Z"}
