{"id":"cash-only-zip-hood","shop_slug":"seasons-skateshop","name":"Cash Only Service Zip Hood Foliage Camo","brand":"Cash Only","category":"apparel","subcategory":"hoodies","price":170.00,"currency":"USD","size":"L","in_stock":true,"quantity":4,"image":"","url":"","tags":["streetwear","hoodie"],"last_updated":"2026-02-10T00:00:00Z"}
