{"id":"bustin-skate-everything-bag","shop_slug":"bustin-boards","name":"Skate Everything One Backpack","brand":"Bustin","category":"accessories","subcategory":"bags","price":74.99,"currency":"USD","size":"one-size","in_stock":false,"quantity":0,"image":"","url":"","tags":["bag","accessories"],"last_updated":"2026-02-10T00:00:00Z"}
