{"id":"cash-only-service-tee","shop_slug":"seasons-skateshop","name":"Cash Only Service Tee White","brand":"Cash Only","category":"apparel","subcategory":"tees","price":42.00,"currency":"USD","size":"L","in_stock":true,"quantity":10,"image":"","url":"","tags":["streetwear","tee"],"last_updated":"2026-02-10T00:00:00Z"}
