{"id":"bustin-maestro-complete","shop_slug":"bustin-boards","name":"Bustin Maestro Complete","brand":"Bustin","category":"decks","subcategory":"longboard","price":299.00,"currency":"USD","size":"40in","in_stock":true,"quantity":4,"image":"","url":"","tags":["longboard","complete","cruiser"],"last_updated":"2026-02-10T00:00:00Z"}
