{"id":"nb-numeric-440","shop_slug":"seasons-skateshop","name":"New Balance Numeric 440","brand":"New Balance","category":"shoes","subcategory":"low-top","price":90.00,"currency":"USD","size":"10","in_stock":true,"quantity":5,"image":"","url":"","tags":["shoes","skate"],"last_updated":"2026-02-10T00:00:00Z"}
