{"id":"dolo-crew-hoodie","shop_slug":"dolo-skate-co","name":"Dolo Crew Hoodie Black","brand":"Dolo","category":"apparel","subcategory":"hoodies","price":65.00,"currency":"USD","size":"L","in_stock":true,"quantity":8,"image":"","url":"","tags":["apparel","house-brand","hoodie"],"last_updated":"2026-02-10T00:00:00Z"}
