{"id":"adidas-busenitz","shop_slug":"uptown-riders","name":"Adidas Busenitz Vulc II","brand":"Adidas","category":"shoes","subcategory":"low-top","price":85.00,"currency":"USD","size":"10","in_stock":true,"quantity":4,"image":"","url":"","tags":["shoes","skate"],"last_updated":"2026-02-10T00:00:00Z"}
