{"id":"diamond-hardware","shop_slug":"uptown-riders","name":"Diamond Supply Co Hardware 7/8","brand":"Diamond","category":"accessories","subcategory":"hardware","price":8.00,"currency":"USD","size":"7/8","in_stock":true,"quantity":25,"image":"","url":"","tags":["hardware","essentials"],"last_updated":"2026-02-10T00:00:00Z"}
