{"id":"dolo-bronx-deck","shop_slug":"dolo-skate-co","name":"Dolo Bronx Logo Deck 8.0","brand":"Dolo","category":"decks","subcategory":"street","price":55.00,"currency":"USD","size":"8.0","in_stock":true,"quantity":10,"image":"","url":"","tags":["street","house-brand","logo"],"last_updated":"2026-02-10T00:00:00Z"}
