{"id":"bustin-shrike-complete","shop_slug":"bustin-boards","name":"Bustin Shrike Complete","brand":"Bustin","category":"decks","subcategory":"longboard","price":299.00,"currency":"USD","size":"37.5in","in_stock":true,"quantity":5,"image":"","url":"","tags":["longboard","complete","freeride"],"last_updated":"2026-02-10T00:00:00Z"}
