{"id":"jessup-griptape","shop_slug":"seasons-skateshop","name":"Jessup Griptape Sheet","brand":"Jessup","category":"accessories","subcategory":"griptape","price":6.00,"currency":"USD","size":"9x33","in_stock":true,"quantity":30,"image":"","url":"","tags":["griptape","essentials"],"last_updated":"2026-02-10T00:00:00Z"}
