{"id":"bones-reds","shop_slug":"kcdc-skateshop","name":"Bones Reds Bearings","brand":"Bones","category":"bearings","subcategory":"standard","price":21.00,"currency":"USD","size":"8-pack","in_stock":true,"quantity":20,"image":"","url":"","tags":["bearings","essentials"],"last_updated":"2026-02-10T00:00:00Z"}
