{"id":"real-team-oval-deck","shop_slug":"uptown-riders","name":"Real Team Oval Deck 8.25","brand":"Real","category":"decks","subcategory":"street","price":60.00,"currency":"USD","size":"8.25","in_stock":true,"quantity":8,"image":"","url":"","tags":["street","deck"],"last_updated":"2026-02-10T00:00:00Z"}
