{"id":"mini-logo-bearings","shop_slug":"dolo-skate-co","name":"Mini Logo Bearings","brand":"Mini Logo","category":"bearings","subcategory":"standard","price":12.00,"currency":"USD","size":"8-pack","in_stock":true,"quantity":15,"image":"","url":"","tags":["bearings","budget"],"last_updated":"2026-02-10T00:00:00Z"}
